{
  "schemaVersion": "2",
  "status": "NO_DATA",
  "analyzedAt": "2026-07-19T09:59:55.301Z",
  "qualifiedReleaseReceiptSha256": null,
  "participantCount": 0,
  "completedSessionCount": 0,
  "metrics": null,
  "limitations": [
    "No consented learner-pilot session records were supplied; no learner outcome is claimed."
  ]
}
